{
  "$schema": "idlewuxia.character_compositions.v2",
  "registryId": "idlewuxia-modular-characters-v2",
  "version": 2,
  "status": "requirements-ready-assets-missing",
  "shippingAllowed": false,
  "policy": {
    "construction": "modular-head-body",
    "view": "side",
    "canonicalFacing": "right",
    "opposingSideTransform": "horizontal-mirror",
    "logicalCanvasPx": { "width": 96, "height": 96 },
    "legSilhouette": "forbidden",
    "movementPhasePolicy": "body-compress-translate-recover",
    "missingPartPolicy": "fail-closed",
    "combatClipByState": {
      "idle": "idle",
      "attack": "attack",
      "skill": "attack",
      "skillResolved": "attack",
      "damage": "hurt",
      "hit": "hurt",
      "block": "hurt",
      "control": "control",
      "defeat": "defeat"
    }
  },
  "requiredParts": ["body", "head-base", "eyes", "mouth", "hair"],
  "optionalParts": ["headwear", "face-accessory", "weapon-rear", "weapon-front", "contact-shadow"],
  "layerOrderBackToFront": ["contact-shadow", "weapon-rear", "body", "head-base", "eyes", "mouth", "hair", "headwear", "face-accessory", "weapon-front"],
  "parts": [],
  "compositions": []
}
